{
  "first_author": "Gundogdu",
  "dataset_id": "0021",
  "year": 2017,
  "reference_a": "@article{gundogdu2017,\n  title = {Investigating the association between social interactions and personality states dynamics},\n  author = {Gundogdu, Didem and Finnerty, Ailbhe N. and Staiano, Jacopo and Teso, Stefano and Passerini, Andrea and Pianesi, Fabio and Lepri, Bruno},\n  date = {2017-09-20},\n  journaltitle = {Royal Society Open Science},\n  volume = {4},\n  number = {9},\n  pages = {170194},\n  publisher = {Royal Society},\n  doi = {10.1098/rsos.170194}\n}",
  "reference_b": null,
  "paper_doi": "https://doi.org/10.1098/rsos.170194",
  "zenodo_doi": "10.5281/zenodo.17347760",
  "link_to_data": "https://doi.org/10.5061/dryad.b88c7",
  "license": "CC0 1.0",
  "link_to_codebook": "https://datadryad.org/stash/dataset/doi:10.5061/dryad.b88c7#usage",
  "link_to_code": "https://github.com/didemgundogdu/RoyalOpenSciencePersonalityDynamics",
  "n_participants": 54,
  "n_time_points": 90,
  "n_days": "30",
  "n_beeps_per_day": "3",
  "passive_data_available": "yes",
  "cross_sectional_available": "no",
  "topics": "social interactions, personality states, personality",
  "implicit_missingness": "yes",
  "raw_time_stamp": "yes",
  "sampling_scheme": "3x/day fixed schedule",
  "participants": "employees of research center",
  "coding_file": "0021_gundogdu_variables",
  "additional_comments": "no beep information available; six-week duration, but only workdays were included",
  "coder_data": "Björn Siepe",
  "coder_metadata": "Björn Siepe",
  "features": [
    {
      "name": "id",
      "description": "Participant ID",
      "variable_type": "categorical",
      "coding": "",
      "answer_categories": "",
      "details": "",
      "labels": "",
      "transformation": "",
      "source": "",
      "assessment_type": "ESM",
      "construct": "",
      "comments": ""
    },
    {
      "name": "day",
      "description": "Day of study",
      "variable_type": "other",
      "coding": "",
      "answer_categories": "",
      "details": "",
      "labels": "",
      "transformation": "",
      "source": "",
      "assessment_type": "ESM",
      "construct": "",
      "comments": ""
    },
    {
      "name": "beep",
      "description": "Beep of the day",
      "variable_type": "other",
      "coding": "NA",
      "answer_categories": "",
      "details": "",
      "labels": "",
      "transformation": "",
      "source": "",
      "assessment_type": "ESM",
      "construct": "",
      "comments": ""
    },
    {
      "name": "date",
      "description": "Date",
      "variable_type": "PosixCt",
      "coding": "With hour and seconds",
      "answer_categories": "",
      "details": "",
      "labels": "",
      "transformation": "",
      "source": "",
      "assessment_type": "ESM",
      "construct": "",
      "comments": ""
    },
    {
      "name": "timestamp",
      "description": "Timestamp",
      "variable_type": "other",
      "coding": "Timestamp in unix time",
      "answer_categories": "",
      "details": "Timestamp in unix time",
      "labels": "",
      "transformation": "",
      "source": "",
      "assessment_type": "ESM",
      "construct": "",
      "comments": ""
    },
    {
      "name": "extraversion",
      "description": "Extraversion",
      "variable_type": "rating_scale",
      "coding": "Average score of the items ‘extraverted, enthusiastic’ and ‘reserved, quiet’ (reversed) (Ten-Item Personality Inventory)\nDuring the last half hour, how ... have you been? \n1 = Strongly disagree\n7 = Strongly agree",
      "answer_categories": "7",
      "details": "‘extraverted, enthusiastic’ and ‘reserved, quiet’ (reversed)\n\nDuring the last half hour, how ... have you been?",
      "labels": "1 = Strongly disagree\n7 = Strongly agree",
      "transformation": "mean-scored",
      "source": "Ten-Item Personality Inventory",
      "assessment_type": "ESM",
      "construct": "extraversion, big five",
      "comments": ""
    },
    {
      "name": "agreeableness",
      "description": "Agreeableness",
      "variable_type": "rating_scale",
      "coding": "Average score of the items ‘sympathetic, warm’ and ‘critical, quarrelsome’ (reversed) (Ten-Item Personality Inventory)\nDuring the last half hour, how ... have you been? \n1 = Strongly disagree\n7 = Strongly agree",
      "answer_categories": "7",
      "details": "‘sympathetic, warm’ and ‘critical, quarrelsome’ (reversed)\nDuring the last half hour, how ... have you been?",
      "labels": "1 = Strongly disagree\n7 = Strongly agree",
      "transformation": "mean-scored",
      "source": "Ten-Item Personality Inventory",
      "assessment_type": "ESM",
      "construct": "agreeableness, big five",
      "comments": ""
    },
    {
      "name": "conscientiousness",
      "description": "Conscientiousness",
      "variable_type": "rating_scale",
      "coding": "Average score of the items ‘dependable, self-disciplined’ and ‘disorganized, careless’ (reversed) (Ten-Item Personality Inventory)\nDuring the last half hour, how ... have you been? \n1 = Strongly disagree\n7 = Strongly agree",
      "answer_categories": "7",
      "details": "‘dependable, self-disciplined’ and ‘disorganized, careless’ (reversed)\nDuring the last half hour, how ... have you been?",
      "labels": "1 = Strongly disagree\n7 = Strongly agree",
      "transformation": "mean-scored",
      "source": "Ten-Item Personality Inventory",
      "assessment_type": "ESM",
      "construct": "conscientiousness, big five",
      "comments": ""
    },
    {
      "name": "emotional_stability",
      "description": "Emotional stability",
      "variable_type": "rating_scale",
      "coding": "Average score of the items ‘calm, emotionally stable’ and ‘anxious, easily upset’ (reversed) (Ten-Item Personality Inventory)\nDuring the last half hour, how ... have you been? \n1 = Strongly disagree\n7 = Strongly agree",
      "answer_categories": "7",
      "details": "‘calm, emotionally stable’ and ‘anxious, easily upset’\nDuring the last half hour, how ... have you been?",
      "labels": "1 = Strongly disagree\n7 = Strongly agree",
      "transformation": "mean-scored",
      "source": "Ten-Item Personality Inventory",
      "assessment_type": "ESM",
      "construct": "neuroticism, big five",
      "comments": ""
    },
    {
      "name": "openness",
      "description": "Openness to experience",
      "variable_type": "rating_scale",
      "coding": "Average score of the items ‘open to new experiences, complex’ and ‘conventional, uncreative’ (reversed) (Ten-Item Personality Inventory)\nDuring the last half hour, how ... have you been? \n1 = Strongly disagree\n7 = Strongly agree",
      "answer_categories": "7",
      "details": "‘open to new experiences, complex’ and ‘conventional, uncreative’ (reversed)\nDuring the last half hour, how ... have you been?",
      "labels": "1 = Strongly disagree\n7 = Strongly agree",
      "transformation": "mean-scored",
      "source": "Ten-Item Personality Inventory",
      "assessment_type": "ESM",
      "construct": "openness, big five",
      "comments": ""
    }
  ]
}
