{
  "first_author": "Dora",
  "dataset_id": "0023",
  "year": 2024,
  "reference_a": "@article{dora2024,\n  title = {A tutorial on analyzing ecological momentary assessment data in psychological research with {{Bayesian}} (generalized) mixed-effects models},\n  author = {Dora, Jonas and McCabe, Connor J. and family=Lissa, given=Caspar J., prefix=van, useprefix=true and Witkiewitz, Katie and King, Kevin M.},\n  date = {2024-01-01},\n  journaltitle = {Advances in Methods and Practices in Psychological Science},\n  volume = {7},\n  number = {1},\n  pages = {25152459241235875},\n  publisher = {SAGE Publications Inc},\n  issn = {2515-2459},\n  doi = {10.1177/25152459241235875}\n}",
  "reference_b": null,
  "paper_doi": "https://doi.org/10.31234/osf.io/jc938",
  "zenodo_doi": null,
  "link_to_data": "https://osf.io/rh2sw/",
  "license": "CC-BY4.0i",
  "link_to_codebook": "https://osf.io/zy639",
  "link_to_code": "https://osf.io/zy639",
  "n_participants": 213,
  "n_time_points": 63,
  "n_days": "22",
  "n_beeps_per_day": "3 or 5",
  "passive_data_available": "no",
  "cross_sectional_available": "yes",
  "topics": "alcohol, self-control demands, intoxication, substance use",
  "implicit_missingness": "yes",
  "raw_time_stamp": "yes",
  "sampling_scheme": "3x/day or 5x/day unclear schedule",
  "participants": "undergraduate students",
  "coding_file": "0023_dora_variables",
  "additional_comments": "data from two studies; item coding based on private codebook; some items assessed daily; number of max. time points taken as maximum of observations in data; raw time stamps at an hour level",
  "coder_data": "Björn Siepe",
  "coder_metadata": "Björn Siepe",
  "features": [
    {
      "name": "id",
      "description": "Participant ID",
      "variable_type": "categorical",
      "coding": "",
      "answer_categories": "",
      "details": "",
      "labels": "",
      "transformation": "",
      "source": "",
      "assessment_type": "ESM",
      "construct": "",
      "comments": ""
    },
    {
      "name": "day",
      "description": "Day of study",
      "variable_type": "other",
      "coding": "",
      "answer_categories": "",
      "details": "",
      "labels": "",
      "transformation": "",
      "source": "",
      "assessment_type": "ESM",
      "construct": "",
      "comments": ""
    },
    {
      "name": "beep",
      "description": "Beep of the day",
      "variable_type": "other",
      "coding": "",
      "answer_categories": "",
      "details": "",
      "labels": "",
      "transformation": "",
      "source": "",
      "assessment_type": "ESM",
      "construct": "",
      "comments": ""
    },
    {
      "name": "study",
      "description": "Study number",
      "variable_type": "categorical",
      "coding": "Study 1 = King, \nStudy 2 = Witkiewitz",
      "answer_categories": "2",
      "details": "Study 1 = King, \nStudy 2 = Witkiewitz",
      "labels": "",
      "transformation": "",
      "source": "",
      "assessment_type": "ESM",
      "construct": "",
      "comments": ""
    },
    {
      "name": "hour",
      "description": "Hour of the day",
      "variable_type": "numeric",
      "coding": "Hour during which EMA survey was completed (rounded down)",
      "answer_categories": "24",
      "details": "Hour of the day during which EMA survey was completed (rounded down)",
      "labels": "",
      "transformation": "",
      "source": "",
      "assessment_type": "ESM",
      "construct": "",
      "comments": ""
    },
    {
      "name": "control_fixmood",
      "description": "Self-control mood",
      "variable_type": "rating_scale",
      "coding": "Have you needed to control/fix your mood?\n0 =  Not at all\n100 = Very much",
      "answer_categories": "101",
      "details": "Have you needed to control/fix your mood?",
      "labels": "0 =  Not at all\n100 = Very much",
      "transformation": "",
      "source": "",
      "assessment_type": "ESM",
      "construct": "emotion regulation, self-regulation",
      "comments": ""
    },
    {
      "name": "control_fixthought",
      "description": "Self-control thought",
      "variable_type": "rating_scale",
      "coding": "Have you needed to control/fix your thoughts?\n0 =  Not at all\n100 = Very much",
      "answer_categories": "101",
      "details": "Have you needed to control/fix your thoughts?",
      "labels": "0 =  Not at all\n100 = Very much",
      "transformation": "",
      "source": "",
      "assessment_type": "ESM",
      "construct": "cognitive control, self-regulation",
      "comments": ""
    },
    {
      "name": "dealt_stress",
      "description": "Dealt with stress",
      "variable_type": "rating_scale",
      "coding": "Have you dealt with anything stressful?\n0 =  Not at all\n100 = Very much",
      "answer_categories": "101",
      "details": "Have you dealt with anything stressful?",
      "labels": "0 =  Not at all\n100 = Very much",
      "transformation": "",
      "source": "",
      "assessment_type": "ESM",
      "construct": "stress, negative affect, affect",
      "comments": ""
    },
    {
      "name": "felt_overwhelm",
      "description": "Felt overwhelmed",
      "variable_type": "rating_scale",
      "coding": "Have you felt overwhelmed?\n0 =  Not at all\n100 = Very much",
      "answer_categories": "101",
      "details": "Have you felt overwhelmed?",
      "labels": "0 =  Not at all\n100 = Very much",
      "transformation": "",
      "source": "",
      "assessment_type": "ESM",
      "construct": "negative affect, affect",
      "comments": ""
    },
    {
      "name": "alc_drinks",
      "description": "Number of standard drinks",
      "variable_type": "numeric",
      "coding": "How many alcoholic drinks did you have yesterday? Please remember that a drink refers to a “standard” drink size: 12 oz. beer, 8-9 oz. malt liquor, 5 oz. wine, 1.5 oz. hard liquor. (0-30 or more)",
      "answer_categories": "31",
      "details": "How many alcoholic drinks did you have yesterday? Please remember that a drink refers to a “standard” drink size: 12 oz. beer, 8-9 oz. malt liquor, 5 oz. wine, 1.5 oz. hard liquor. (0-30 or more)",
      "labels": "",
      "transformation": "",
      "source": "",
      "assessment_type": "ESM",
      "construct": "alcohol, substance use",
      "comments": ""
    },
    {
      "name": "alc_intox",
      "description": "How drunk",
      "variable_type": "rating_scale",
      "coding": "If you drank alcohol yesterday, how drunk or intoxicated did you get?\n0 = Not at all\n6 = Very much",
      "answer_categories": "7",
      "details": "If you drank alcohol yesterday, how drunk or intoxicated did you get?",
      "labels": "0 = Not at all\n6 = Very much",
      "transformation": "",
      "source": "",
      "assessment_type": "ESM",
      "construct": "intoxication, alcohol, substance use",
      "comments": ""
    },
    {
      "name": "alc_hangover",
      "description": "Had hangover",
      "variable_type": "binary",
      "coding": "I had a hangover\n0 = No\n1 = Yes",
      "answer_categories": "2",
      "details": "I had a hangover",
      "labels": "0 = No\n1 = Yes",
      "transformation": "",
      "source": "",
      "assessment_type": "ESM",
      "construct": "intoxication, alcohol, substance use",
      "comments": ""
    },
    {
      "name": "alc_vomit",
      "description": "Did vomit",
      "variable_type": "binary",
      "coding": "I felt nauseated or vomited\n0 = No\n1 = Yes",
      "answer_categories": "2",
      "details": "I felt nauseated or vomited",
      "labels": "0 = No\n1 = Yes",
      "transformation": "",
      "source": "",
      "assessment_type": "ESM",
      "construct": "intoxication, alcohol, substance use",
      "comments": ""
    },
    {
      "name": "alc_blackout",
      "description": "Had blackout",
      "variable_type": "binary",
      "coding": "I couldn’t remember what I did while drinking\n0 = No\n1 = Yes",
      "answer_categories": "2",
      "details": "I couldn’t remember what I did while drinking",
      "labels": "0 = No\n1 = Yes",
      "transformation": "",
      "source": "",
      "assessment_type": "ESM",
      "construct": "intoxication, alcohol, substance use",
      "comments": ""
    },
    {
      "name": "alc_hurt",
      "description": "Did injure self",
      "variable_type": "binary",
      "coding": "I hurt or injured myself by accident\n0 = No\n1 = Yes",
      "answer_categories": "2",
      "details": "I hurt or injured myself by accident",
      "labels": "0 = No\n1 = Yes",
      "transformation": "",
      "source": "",
      "assessment_type": "ESM",
      "construct": "intoxication, alcohol, substance use",
      "comments": ""
    },
    {
      "name": "alc_onset",
      "description": "Onset of drinking",
      "variable_type": "numeric",
      "coding": "About what time did you begin drinking? (Corresponding to beep)",
      "answer_categories": "24",
      "details": "About what time did you begin drinking? (Corresponding to beep)",
      "labels": "",
      "transformation": "",
      "source": "",
      "assessment_type": "ESM",
      "construct": "alcohol, substance use",
      "comments": ""
    }
  ]
}
