{
  "first_author": "Rowland",
  "dataset_id": "0006",
  "year": 2020,
  "reference_a": "@article{rowland2020,\n  title = {Mindfulness and affect-network density: does mindfulness facilitate disengagement from affective experiences in daily life?},\n  shorttitle = {Mindfulness and affect-network density},\n  author = {Rowland, Zarah and Wenzel, Mario},\n  date = {2020-05-01},\n  journaltitle = {Mindfulness},\n  volume = {11},\n  number = {5},\n  pages = {1253--1266},\n  doi = {10.1007/s12671-020-01335-4}\n}",
  "reference_b": null,
  "paper_doi": "https://doi.org/10.1007/s12671-020-01335-4",
  "zenodo_doi": null,
  "link_to_data": "https://osf.io/jmz2n/",
  "license": "CC BY-NC 4.0",
  "link_to_codebook": "https://osf.io/5t4yg",
  "link_to_code": "https://osf.io/jmz2n/",
  "n_participants": 125,
  "n_time_points": 240,
  "n_beeps_per_day": "6",
  "passive_data_available": "no",
  "cross_sectional_available": "yes",
  "topics": "mindfulness, affect, network",
  "implicit_missingness": "no",
  "raw_time_stamp": "no",
  "sampling_scheme": "6x/day random timing",
  "participants": "undergraduate students",
  "coding_file": "0006_rowland_variables",
  "additional_comments": null,
  "coder_data": "Björn Siepe",
  "coder_metadata": "Björn Siepe",
  "features": [
    {
      "name": "id",
      "description": "Participant ID",
      "variable_type": "categorical",
      "coding": "",
      "answer_categories": "",
      "details": "",
      "labels": "",
      "transformation": "",
      "source": "",
      "assessment_type": "ESM",
      "construct": "",
      "comments": ""
    },
    {
      "name": "day",
      "description": "Day of study",
      "variable_type": "other",
      "coding": "",
      "answer_categories": "",
      "details": "",
      "labels": "",
      "transformation": "",
      "source": "",
      "assessment_type": "ESM",
      "construct": "",
      "comments": ""
    },
    {
      "name": "beep",
      "description": "Beep of the day",
      "variable_type": "other",
      "coding": "",
      "answer_categories": "",
      "details": "",
      "labels": "",
      "transformation": "",
      "source": "",
      "assessment_type": "ESM",
      "construct": "",
      "comments": ""
    },
    {
      "name": "happy",
      "description": "Happy",
      "variable_type": "rating_scale",
      "coding": "0 (not at all) to 100 (very much)",
      "answer_categories": "101",
      "details": "",
      "labels": "0 (not at all) to 100 (very much)",
      "transformation": "within-person centered",
      "source": "",
      "assessment_type": "ESM",
      "construct": "happiness, positive affect, affect",
      "comments": "\"We assessed affect in terms of eight common emotional states (e.g., Kuppens et al. 2010), which were based on the affective circumplex model (Russell 2003).\""
    },
    {
      "name": "excited",
      "description": "Excited",
      "variable_type": "rating_scale",
      "coding": "0 (not at all) to 100 (very much)",
      "answer_categories": "101",
      "details": "",
      "labels": "0 (not at all) to 100 (very much)",
      "transformation": "within-person centered",
      "source": "",
      "assessment_type": "ESM",
      "construct": "excitement, positive affect, affect, extraversion, big five",
      "comments": ""
    },
    {
      "name": "relaxed",
      "description": "Relaxed",
      "variable_type": "rating_scale",
      "coding": "0 (not at all) to 100 (very much)",
      "answer_categories": "101",
      "details": "",
      "labels": "0 (not at all) to 100 (very much)",
      "transformation": "within-person centered",
      "source": "",
      "assessment_type": "ESM",
      "construct": "relaxation, positive affect, affect",
      "comments": ""
    },
    {
      "name": "satisfied",
      "description": "Satisfied",
      "variable_type": "rating_scale",
      "coding": "0 (not at all) to 100 (very much)",
      "answer_categories": "101",
      "details": "",
      "labels": "0 (not at all) to 100 (very much)",
      "transformation": "within-person centered",
      "source": "",
      "assessment_type": "ESM",
      "construct": "satisfaction, positive affect, affect",
      "comments": ""
    },
    {
      "name": "angry",
      "description": "Angry",
      "variable_type": "rating_scale",
      "coding": "0 (not at all) to 100 (very much)",
      "answer_categories": "101",
      "details": "",
      "labels": "0 (not at all) to 100 (very much)",
      "transformation": "within-person centered",
      "source": "",
      "assessment_type": "ESM",
      "construct": "anger, negative affect, affect",
      "comments": ""
    },
    {
      "name": "anxious",
      "description": "Anxious",
      "variable_type": "rating_scale",
      "coding": "0 (not at all) to 100 (very much)",
      "answer_categories": "101",
      "details": "",
      "labels": "0 (not at all) to 100 (very much)",
      "transformation": "within-person centered",
      "source": "",
      "assessment_type": "ESM",
      "construct": "anxiety, negative affect, affect, neuroticism, big five",
      "comments": ""
    },
    {
      "name": "depressed",
      "description": "Depressed",
      "variable_type": "rating_scale",
      "coding": "0 (not at all) to 100 (very much)",
      "answer_categories": "101",
      "details": "",
      "labels": "0 (not at all) to 100 (very much)",
      "transformation": "within-person centered",
      "source": "",
      "assessment_type": "ESM",
      "construct": "depression, negative affect, affect, neuroticism, big five, psychopathology",
      "comments": ""
    },
    {
      "name": "sad",
      "description": "Sad",
      "variable_type": "rating_scale",
      "coding": "0 (not at all) to 100 (very much)",
      "answer_categories": "101",
      "details": "",
      "labels": "0 (not at all) to 100 (very much)",
      "transformation": "within-person centered",
      "source": "",
      "assessment_type": "ESM",
      "construct": "sadness, negative affect, affect",
      "comments": ""
    }
  ]
}
