{
  "first_author": "Contreras",
  "dataset_id": "0028",
  "year": 2020,
  "reference_a": "@article{contreras2020,\n  title = {A temporal network approach to paranoia: {{A}} pilot study},\n  shorttitle = {A temporal network approach to paranoia},\n  author = {Contreras, Alba and Valiente, Carmen and Heeren, Alexandre and Bentall, Richard},\n  date = {2020-09-18},\n  journaltitle = {Frontiers in Psychology},\n  shortjournal = {Front. Psychol.},\n  volume = {11},\n  publisher = {Frontiers},\n  issn = {1664-1078},\n  doi = {10.3389/fpsyg.2020.544565}\n}",
  "reference_b": null,
  "paper_doi": "https://doi.org/10.3389/fpsyg.2020.544565",
  "zenodo_doi": "10.5281/zenodo.17347605",
  "dataset_version": "1.0.0",
  "changelog": [
    {
      "date": "2026-10-14",
      "description": "Change coding of empty additional comments field.",
      "type": "metadata",
      "dataset_version": "1.0.0"
    },
    {
      "date": "2025-10-14",
      "description": "Initial release.",
      "type": "data",
      "dataset_version": "1.0.0"
    }
  ],
  "link_to_data": "https://osf.io/7tk4b/",
  "license": "CC-BY 4.0",
  "link_to_codebook": "https://osf.io/bkn3y",
  "link_to_code": "https://osf.io/mezgw",
  "n_participants": 23,
  "n_time_points": 70,
  "n_days": "7",
  "n_beeps_per_day": "10",
  "passive_data_available": "no",
  "cross_sectional_available": "no",
  "topics": "paranoia, sadness, closeness to others, avoidance",
  "implicit_missingness": "no",
  "raw_time_stamp": "no",
  "sampling_scheme": "10x/day stratified sampling",
  "participants": "participants with above-average paranoid ideation and/or interpersonal sensitivity",
  "coding_file": "0028_contreras_variables",
  "additional_comments": null,
  "coder_data": "Björn Siepe",
  "coder_metadata": "Björn Siepe",
  "features": [
    {
      "name": "id",
      "description": "Participant ID",
      "variable_type": "categorical",
      "coding": "",
      "answer_categories": "",
      "details": "",
      "labels": "",
      "transformation": "",
      "source": "",
      "assessment_type": "ESM",
      "construct": "",
      "comments": ""
    },
    {
      "name": "day",
      "description": "Day of study",
      "variable_type": "other",
      "coding": "",
      "answer_categories": "",
      "details": "",
      "labels": "",
      "transformation": "",
      "source": "",
      "assessment_type": "ESM",
      "construct": "",
      "comments": ""
    },
    {
      "name": "beep",
      "description": "Beep of the day",
      "variable_type": "other",
      "coding": "",
      "answer_categories": "",
      "details": "",
      "labels": "",
      "transformation": "",
      "source": "",
      "assessment_type": "ESM",
      "construct": "",
      "comments": ""
    },
    {
      "name": "sad",
      "description": "Sadness",
      "variable_type": "rating_scale",
      "coding": "At this moment, I feel sad",
      "answer_categories": "9",
      "details": "At this moment, I feel sad",
      "labels": "",
      "transformation": "",
      "source": "",
      "assessment_type": "ESM",
      "construct": "sadness, negative affect, affect",
      "comments": ""
    },
    {
      "name": "useless",
      "description": "Useless",
      "variable_type": "rating_scale",
      "coding": "At this moment, I feel useless (Self-Esteem 1)",
      "answer_categories": "9",
      "details": "At this moment, I feel useless",
      "labels": "",
      "transformation": "",
      "source": "Rosenberg Self-esteem Scale (RSES)",
      "assessment_type": "ESM",
      "construct": "worthlessness, negative affect, affect, big five, neuroticism, self-esteem",
      "comments": ""
    },
    {
      "name": "manage_well",
      "description": "Manage issues well",
      "variable_type": "rating_scale",
      "coding": "At this moment, I feel I can manage issues well (Self-Esteem 1)",
      "answer_categories": "9",
      "details": "At this moment, I feel I can manage issues well",
      "labels": "",
      "transformation": "",
      "source": "Rosenberg Self-esteem Scale (RSES)",
      "assessment_type": "ESM",
      "construct": "self-efficacy, self-esteem, coping",
      "comments": ""
    },
    {
      "name": "no_trust",
      "description": "Cannot trust people",
      "variable_type": "rating_scale",
      "coding": "Since the last “beep”, I have had the \nimpression that I cannot trust peopl (Paranoia 1)",
      "answer_categories": "9",
      "details": "Since the last “beep”, I have had the \nimpression that I cannot trust people",
      "labels": "",
      "transformation": "",
      "source": "Persecutory Ideation Questionnaire (PIQ)",
      "assessment_type": "ESM",
      "construct": "distrust, paranoia, social cognition, schizophrenia, psychopathology",
      "comments": ""
    },
    {
      "name": "harm",
      "description": "Perceived harm intention",
      "variable_type": "rating_scale",
      "coding": "Since the last “beep”, I have had the \nimpression that people have tried to harm \nme",
      "answer_categories": "9",
      "details": "Since the last “beep”, I have had the \nimpression that people have tried to harm \nme",
      "labels": "",
      "transformation": "",
      "source": "Persecutory Ideation Questionnaire (PIQ)",
      "assessment_type": "ESM",
      "construct": "paranoia, social cognition, schizophrenia, psychopathology",
      "comments": ""
    },
    {
      "name": "criticism",
      "description": "Was criticized",
      "variable_type": "rating_scale",
      "coding": "Since the last “beep”, I have had the \nimpression that people have criticized me",
      "answer_categories": "9",
      "details": "Since the last “beep”, I have had the \nimpression that people have criticized me",
      "labels": "",
      "transformation": "",
      "source": "Persecutory Ideation Questionnaire (PIQ)",
      "assessment_type": "ESM",
      "construct": "criticism, social threat, social cognition",
      "comments": ""
    },
    {
      "name": "others",
      "description": "Close to others",
      "variable_type": "rating_scale",
      "coding": "At this moment, I feel close to others",
      "answer_categories": "9",
      "details": "At this moment, I feel close to others",
      "labels": "",
      "transformation": "",
      "source": "",
      "assessment_type": "ESM",
      "construct": "social connectedness, belongingness, social bonds",
      "comments": ""
    },
    {
      "name": "avoid",
      "description": "Experiential avoidance",
      "variable_type": "rating_scale",
      "coding": "Since the last “beep”, I have tried to \navoid negative thoughts and feelings",
      "answer_categories": "9",
      "details": "Since the last “beep”, I have tried to \navoid negative thoughts and feelings",
      "labels": "",
      "transformation": "",
      "source": "Acceptance and Action Questionnaire-II",
      "assessment_type": "ESM",
      "construct": "avoidance, emotion regulation, self-regulation",
      "comments": ""
    }
  ]
}
