{
  "first_author": "Koval",
  "dataset_id": "0031",
  "year": 2013,
  "reference_a": "@article{koval2013,\n  title = {Affect dynamics in relation to depressive symptoms: {{Variable}}, unstable or inert?},\n  shorttitle = {Affect dynamics in relation to depressive symptoms},\n  author = {Koval, Peter and Pe, Madeline L. and Meers, Kristof and Kuppens, Peter},\n  date = {2013-12},\n  journaltitle = {Emotion},\n  shortjournal = {Emotion},\n  volume = {13},\n  number = {6},\n  pages = {1132--1141},\n  doi = {10.1037/a0033579}\n}",
  "reference_b": "@article{dejonckheere2019b,\n  title = {Complex affect dynamics add limited information to the prediction of psychological well-being},\n  author = {Dejonckheere, Egon and Mestdagh, Merijn and Houben, Marlies and Rutten, Isa and Sels, Laura and Kuppens, Peter and Tuerlinckx, Francis},\n  date = {2019-04-15},\n  journaltitle = {Nature Human Behaviour},\n  shortjournal = {Nat Hum Behav},\n  volume = {3},\n  number = {5},\n  pages = {478--491},\n  issn = {2397-3374},\n  doi = {10.1038/s41562-019-0555-0}\n}",
  "paper_doi": "http://doi.org/10.1037/a0033579",
  "zenodo_doi": null,
  "link_to_data": "https://osf.io/zm6uw",
  "license": "CC BY-NC 4.0",
  "link_to_codebook": "-",
  "link_to_code": "https://osf.io/x4rne",
  "n_participants": 95,
  "n_time_points": 70,
  "n_days": "7",
  "n_beeps_per_day": "10",
  "passive_data_available": "no",
  "cross_sectional_available": "yes",
  "topics": "well-being, affect, depression, affect dynamics",
  "implicit_missingness": "no",
  "raw_time_stamp": "no",
  "sampling_scheme": "10x/day stratified random interval",
  "participants": "undergraduate students",
  "coding_file": "0031_koval_variables",
  "additional_comments": "subset of larger dataset available upon request in the EMOTE database (https://emotedatabase.com/datasets/23)",
  "coder_data": "Björn Siepe",
  "coder_metadata": "Björn Siepe",
  "features": [
    {
      "name": "id",
      "description": "Participant ID",
      "variable_type": "categorical",
      "coding": "",
      "answer_categories": "",
      "details": "",
      "labels": "",
      "transformation": "",
      "source": "",
      "assessment_type": "ESM",
      "construct": "",
      "comments": ""
    },
    {
      "name": "day",
      "description": "Day of study",
      "variable_type": "other",
      "coding": "",
      "answer_categories": "",
      "details": "",
      "labels": "",
      "transformation": "",
      "source": "",
      "assessment_type": "ESM",
      "construct": "",
      "comments": ""
    },
    {
      "name": "beep",
      "description": "Beep of the day",
      "variable_type": "other",
      "coding": "",
      "answer_categories": "",
      "details": "",
      "labels": "",
      "transformation": "",
      "source": "",
      "assessment_type": "ESM",
      "construct": "",
      "comments": ""
    },
    {
      "name": "happy",
      "description": "Happy",
      "variable_type": "rating_scale",
      "coding": "Felt happy\n0 = not at all\n100 = very much",
      "answer_categories": "101",
      "details": "Felt happy",
      "labels": "0 = not at all\n100 = very much",
      "transformation": "",
      "source": "",
      "assessment_type": "ESM",
      "construct": "happiness, positive affect, affect",
      "comments": ""
    },
    {
      "name": "relaxed",
      "description": "Relaxed",
      "variable_type": "rating_scale",
      "coding": "Felt relaxed\n0 = not at all\n100 = very much",
      "answer_categories": "101",
      "details": "Felt relaxed",
      "labels": "0 = not at all\n100 = very much",
      "transformation": "",
      "source": "",
      "assessment_type": "ESM",
      "construct": "relaxation, positive affect, affect, neuroticism, big five",
      "comments": ""
    },
    {
      "name": "sad",
      "description": "Sad",
      "variable_type": "rating_scale",
      "coding": "Felt sad\n0 = not at all\n100 = very much",
      "answer_categories": "101",
      "details": "Felt sad",
      "labels": "0 = not at all\n100 = very much",
      "transformation": "",
      "source": "",
      "assessment_type": "ESM",
      "construct": "sadness, negative affect, affect",
      "comments": ""
    },
    {
      "name": "angry",
      "description": "Angry",
      "variable_type": "rating_scale",
      "coding": "Felt angry\n0 = not at all\n100 = very much",
      "answer_categories": "101",
      "details": "Felt angry",
      "labels": "0 = not at all\n100 = very much",
      "transformation": "",
      "source": "",
      "assessment_type": "ESM",
      "construct": "anger, negative affect, affect",
      "comments": ""
    },
    {
      "name": "stressed",
      "description": "Stress",
      "variable_type": "rating_scale",
      "coding": "Felt stress\n0 = not at all\n100 = very much",
      "answer_categories": "101",
      "details": "Felt stressed",
      "labels": "0 = not at all\n100 = very much",
      "transformation": "",
      "source": "",
      "assessment_type": "ESM",
      "construct": "stress, negative affect, affect",
      "comments": ""
    }
  ]
}
