{
  "first_author": "Tammilehto",
  "dataset_id": "0054",
  "year": 2022,
  "reference_a": "@article{tammilehto2022,\n  title = {Dynamics of attachment and emotion regulation in daily life: {{Uni-}} and bidirectional associations},\n  shorttitle = {Dynamics of attachment and emotion regulation in daily life},\n  author = {Tammilehto, Jaakko and {Bosmans ,Guy} and {Kuppens ,Peter} and {Flykt ,Marjo} and {Peltonen ,Kirsi} and {Kerns ,Kathryn A.} and Lindblom, Jallu},\n  date = {2022-08-18},\n  journaltitle = {Cognition and Emotion},\n  volume = {36},\n  number = {6},\n  eprint = {35674671},\n  eprinttype = {pubmed},\n  pages = {1109--1131},\n  publisher = {Routledge},\n  issn = {0269-9931},\n  doi = {10.1080/02699931.2022.2081534}\n}",
  "reference_b": null,
  "paper_doi": "https://doi.org/10.1080/02699931.2022.2081534",
  "zenodo_doi": "10.5281/zenodo.17361509",
  "dataset_version": "2.0.0",
  "changelog": [
    {
      "date": "2026-09-25",
      "description": "Removal of uncleaned static data pending privacy review.",
      "type": "data",
      "dataset_version": "2.0.0"
    },
    {
      "date": "2025-10-15",
      "description": "Initial release.",
      "type": "data",
      "dataset_version": "1.0.0"
    }
  ],
  "link_to_data": "https://osf.io/e8423",
  "license": "CC-BY 4.0",
  "link_to_codebook": "https://osf.io/u59nd/files/",
  "link_to_code": "https://osf.io/u59nd/files/",
  "n_participants": 122,
  "n_time_points": 49,
  "n_days": "7",
  "n_beeps_per_day": "7",
  "passive_data_available": "no",
  "cross_sectional_available": "yes",
  "topics": "emotion regulation, attachment, neuroticism",
  "implicit_missingness": "no",
  "raw_time_stamp": "yes",
  "sampling_scheme": "7x/day semi-random intervals, scheduled in blocks",
  "participants": "undergraduate students",
  "coding_file": "0054_tammilehto_variables",
  "additional_comments": "no day and beep information available",
  "coder_data": "Björn Siepe",
  "coder_metadata": "Björn Siepe",
  "features": [
    {
      "name": "id",
      "description": "Participant ID",
      "variable_type": "categorical",
      "coding": "",
      "answer_categories": "",
      "details": "",
      "labels": "",
      "transformation": "",
      "source": "",
      "assessment_type": "ESM",
      "construct": "",
      "comments": ""
    },
    {
      "name": "day",
      "description": "Day of study",
      "variable_type": "other",
      "coding": "not available",
      "answer_categories": "",
      "details": "not available",
      "labels": "",
      "transformation": "",
      "source": "",
      "assessment_type": "ESM",
      "construct": "",
      "comments": ""
    },
    {
      "name": "beep",
      "description": "Beep of the day",
      "variable_type": "other",
      "coding": "not available",
      "answer_categories": "",
      "details": "not available",
      "labels": "",
      "transformation": "",
      "source": "",
      "assessment_type": "ESM",
      "construct": "",
      "comments": ""
    },
    {
      "name": "discrete_time",
      "description": "Discrete time since study beginning",
      "variable_type": "numeric",
      "coding": "Discrete time (1 hour and 43 min blocks 1= first block to 92 =\nlast block)",
      "answer_categories": "92",
      "details": "Discrete time (1 hour and 43 min blocks)",
      "labels": "1= first block\n92 = last block",
      "transformation": "",
      "source": "",
      "assessment_type": "ESM",
      "construct": "",
      "comments": ""
    },
    {
      "name": "time_elapsed",
      "description": "Time elapsed",
      "variable_type": "numeric",
      "coding": "Time of receiving EMA questionnaires in hours from the\nbeginning of the study",
      "answer_categories": "",
      "details": "Time of receiving EMA questionnaires in hours from the\nbeginning of the study",
      "labels": "",
      "transformation": "",
      "source": "",
      "assessment_type": "ESM",
      "construct": "",
      "comments": ""
    },
    {
      "name": "reappraisal",
      "description": "Reappraisal",
      "variable_type": "rating_scale",
      "coding": "I thought about the situation in a more positive way\n1 = not at all\n5 = very much",
      "answer_categories": "5",
      "details": "I thought about the situation in a more positive way",
      "labels": "",
      "transformation": "",
      "source": "",
      "assessment_type": "ESM",
      "construct": "reappraisal, emotion regulation",
      "comments": ""
    },
    {
      "name": "rumination",
      "description": "Rumination",
      "variable_type": "rating_scale",
      "coding": "I thought over and over again about the negative situation and\nfeelings\n1 = not at all\n5 = very much",
      "answer_categories": "5",
      "details": "I thought over and over again about the negative situation and\nfeelings",
      "labels": "",
      "transformation": "",
      "source": "",
      "assessment_type": "ESM",
      "construct": "rumination, emotion regulation",
      "comments": ""
    },
    {
      "name": "suppression",
      "description": "Suppression",
      "variable_type": "rating_scale",
      "coding": "I avoided showing my situation-elicited negative feelings\n1 = not at all\n5 = very much",
      "answer_categories": "5",
      "details": "I avoided showing my situation-elicited negative feelings",
      "labels": "",
      "transformation": "",
      "source": "",
      "assessment_type": "ESM",
      "construct": "suppression, emotion regulation",
      "comments": ""
    },
    {
      "name": "feel_loved",
      "description": "Feeling loved",
      "variable_type": "rating_scale",
      "coding": "I feel loved\n1 = strongly disagree\n7 = strongly agree\nPart of attachment security (State Adult Attachment Measure)",
      "answer_categories": "7",
      "details": "I feel loved",
      "labels": "",
      "transformation": "",
      "source": "State Adult Attachment Measure",
      "assessment_type": "ESM",
      "construct": "attachment security, attachment",
      "comments": ""
    },
    {
      "name": "rely_on",
      "description": "Rely on someone",
      "variable_type": "rating_scale",
      "coding": "I feel like I have someone to rely on\n1 = strongly disagree\n7 = strongly agree\nPart of attachment security (State Adult Attachment Measure)",
      "answer_categories": "7",
      "details": "I feel like I have someone to rely on",
      "labels": "",
      "transformation": "",
      "source": "State Adult Attachment Measure",
      "assessment_type": "ESM",
      "construct": "attachment security, attachment, social support",
      "comments": ""
    },
    {
      "name": "need_love",
      "description": "Need for love",
      "variable_type": "rating_scale",
      "coding": "I feel a strong need to be unconditionally loved right now\n1 = strongly disagree\n7 = strongly agree\nPart of attachment anxiety (State Adult Attachment Measure)",
      "answer_categories": "7",
      "details": "I feel a strong need to be unconditionally loved right now",
      "labels": "",
      "transformation": "",
      "source": "State Adult Attachment Measure",
      "assessment_type": "ESM",
      "construct": "attachment anxiety, attachment, social needs",
      "comments": ""
    },
    {
      "name": "share_feelings",
      "description": "Wanting to share feelings",
      "variable_type": "rating_scale",
      "coding": "I want to share my feelings with someone\n1 = strongly disagree\n7 = strongly agree\nPart of attachment anxiety (State Adult Attachment Measure)",
      "answer_categories": "7",
      "details": "I want to share my feelings with someone",
      "labels": "",
      "transformation": "",
      "source": "State Adult Attachment Measure",
      "assessment_type": "ESM",
      "construct": "attachment anxiety, attachment, social needs",
      "comments": ""
    },
    {
      "name": "keep_distance",
      "description": "Keeping distance",
      "variable_type": "rating_scale",
      "coding": "If someone tried to get close to me, I would try to keep my\ndistance\n1 = strongly disagree\n7 = strongly agree\nPart of attachment avoidance (State Adult Attachment Measure)",
      "answer_categories": "7",
      "details": "If someone tried to get close to me, I would try to keep my\ndistance",
      "labels": "",
      "transformation": "",
      "source": "State Adult Attachment Measure",
      "assessment_type": "ESM",
      "construct": "attachment avoidance, attachment, social behavior",
      "comments": ""
    },
    {
      "name": "closeness_nervous",
      "description": "Emotional closeness makes nervous",
      "variable_type": "rating_scale",
      "coding": "The idea of being emotionally close to someone makes me\nnervous\n1 = strongly disagree\n7 = strongly agree\nPart of attachment avoidance (State Adult Attachment Measure)",
      "answer_categories": "7",
      "details": "The idea of being emotionally close to someone makes me\nnervous",
      "labels": "",
      "transformation": "",
      "source": "State Adult Attachment Measure",
      "assessment_type": "ESM",
      "construct": "attachment avoidance, attachment, social anxiety",
      "comments": ""
    }
  ]
}
