{
  "first_author": "Drukker",
  "dataset_id": "0029",
  "year": 2020,
  "reference_a": "@article{drukker2020,\n  title = {Network approach of mood and functional gastrointestinal symptom dynamics in relation to childhood trauma in patients with irritable bowel syndrome and comorbid panic disorder},\n  author = {Drukker, Marjan and Peters, Jill C. H. and Vork, Lisa and Mujagic, Zlatan and Rutten, Bart P. F. and family=Os, given=Jim, prefix=van, useprefix=true and Masclee, Ad A. M. and Kruimel, Joanna W. and Leue, Carsten},\n  date = {2020-12-01},\n  journaltitle = {Journal of Psychosomatic Research},\n  shortjournal = {Journal of Psychosomatic Research},\n  volume = {139},\n  pages = {110261},\n  issn = {0022-3999},\n  doi = {10.1016/j.jpsychores.2020.110261}\n}",
  "reference_b": null,
  "paper_doi": "https://doi.org/10.1016/j.jpsychores.2020.110261",
  "zenodo_doi": "10.5281/zenodo.17347944",
  "dataset_version": "1.0.0",
  "changelog": [
    {
      "date": "2026-10-14",
      "description": "Change coding of empty additional comments field.",
      "type": "metadata",
      "dataset_version": "1.0.0"
    },
    {
      "date": "2025-10-14",
      "description": "Initial release.",
      "type": "data",
      "dataset_version": "1.0.0"
    }
  ],
  "link_to_data": "https://www.sciencedirect.com/science/article/pii/S0022399920308230?via%3Dihub#s0125",
  "license": "CC BY-NC 4.0",
  "link_to_codebook": "https://www.sciencedirect.com/science/article/pii/S0022399920308230?via%3Dihub#s0120",
  "link_to_code": null,
  "n_participants": 24,
  "n_time_points": 70,
  "n_days": "7",
  "n_beeps_per_day": "10",
  "passive_data_available": "no",
  "cross_sectional_available": "yes",
  "topics": "irritable bowel syndrome, panic disorder, gastrointestinal symptoms, childhood trauma",
  "implicit_missingness": "yes",
  "raw_time_stamp": "no",
  "sampling_scheme": "10x/day random schedule",
  "participants": "individuals with IBS and panic disorder",
  "coding_file": "0029_drukker_variables",
  "additional_comments": null,
  "coder_data": "Björn Siepe",
  "coder_metadata": "Björn Siepe",
  "features": [
    {
      "name": "id",
      "description": "Participant ID",
      "variable_type": "categorical",
      "coding": "",
      "answer_categories": "",
      "details": "",
      "labels": "",
      "transformation": "",
      "source": "",
      "assessment_type": "ESM",
      "construct": "",
      "comments": ""
    },
    {
      "name": "day",
      "description": "Day of study",
      "variable_type": "other",
      "coding": "",
      "answer_categories": "",
      "details": "",
      "labels": "",
      "transformation": "",
      "source": "",
      "assessment_type": "ESM",
      "construct": "",
      "comments": ""
    },
    {
      "name": "beep",
      "description": "Beep of the day",
      "variable_type": "other",
      "coding": "",
      "answer_categories": "",
      "details": "",
      "labels": "",
      "transformation": "",
      "source": "",
      "assessment_type": "ESM",
      "construct": "",
      "comments": ""
    },
    {
      "name": "enthusiastic",
      "description": "Enthusiastic",
      "variable_type": "rating_scale",
      "coding": "I feel enthusiastic\n1 = not at all\n7 = extremely",
      "answer_categories": "7",
      "details": "I feel enthusiastic",
      "labels": "1 = not at all\n7 = extremely",
      "transformation": "",
      "source": "",
      "assessment_type": "ESM",
      "construct": "enthusiasm, positive affect, affect, extraversion, big five",
      "comments": ""
    },
    {
      "name": "down",
      "description": "Feeling down",
      "variable_type": "rating_scale",
      "coding": "I feel down\n1 = not at all\n7 = extremely",
      "answer_categories": "7",
      "details": "I feel down",
      "labels": "1 = not at all\n7 = extremely",
      "transformation": "",
      "source": "",
      "assessment_type": "ESM",
      "construct": "negative affect, affect",
      "comments": ""
    },
    {
      "name": "irritated",
      "description": "Irritated",
      "variable_type": "rating_scale",
      "coding": "I feel irritated\n1 = not at all\n7 = extremely",
      "answer_categories": "7",
      "details": "I feel irritated",
      "labels": "1 = not at all\n7 = extremely",
      "transformation": "",
      "source": "",
      "assessment_type": "ESM",
      "construct": "irritability, anxiety, negative affect, affect",
      "comments": ""
    },
    {
      "name": "rushed",
      "description": "Rushed",
      "variable_type": "rating_scale",
      "coding": "I feel rushed\n1 = not at all\n7 = extremely",
      "answer_categories": "7",
      "details": "I feel rushed",
      "labels": "1 = not at all\n7 = extremely",
      "transformation": "",
      "source": "",
      "assessment_type": "ESM",
      "construct": "negative affect, affect",
      "comments": ""
    },
    {
      "name": "happy",
      "description": "Happy",
      "variable_type": "rating_scale",
      "coding": "I feel happy\n1 = not at all\n7 = extremely",
      "answer_categories": "7",
      "details": "I feel happy",
      "labels": "1 = not at all\n7 = extremely",
      "transformation": "",
      "source": "",
      "assessment_type": "ESM",
      "construct": "happiness, positive affect, affect",
      "comments": ""
    },
    {
      "name": "cheerful",
      "description": "Cheerful",
      "variable_type": "rating_scale",
      "coding": "I feel cheerful\n1 = not at all\n7 = extremely",
      "answer_categories": "7",
      "details": "I feel cheerful",
      "labels": "1 = not at all\n7 = extremely",
      "transformation": "",
      "source": "",
      "assessment_type": "ESM",
      "construct": "cheerfulness, positive affect, affect",
      "comments": ""
    },
    {
      "name": "phy_bloating",
      "description": "Bloating",
      "variable_type": "rating_scale",
      "coding": "unclear",
      "answer_categories": "7",
      "details": "",
      "labels": "unclear",
      "transformation": "",
      "source": "",
      "assessment_type": "ESM",
      "construct": "gastrointestinal, physical health, physical symptom",
      "comments": ""
    },
    {
      "name": "phy_abd",
      "description": "Abdominal pain",
      "variable_type": "rating_scale",
      "coding": "unclear",
      "answer_categories": "7",
      "details": "",
      "labels": "unclear",
      "transformation": "",
      "source": "",
      "assessment_type": "ESM",
      "construct": "gastrointestinal, physical health, physical symptom",
      "comments": ""
    }
  ]
}
